{
    "admin_token": "hunter2",
    "api_bind_addrs": [
        "0:443",
        "[::]:443"
    ],
    "global_addrs": [
        {
            "fixed": "203.0.113.111"
        },
        {
            "from_interface": {
                "ip_version": "v6",
                "name": "eth0"
            }
        },
        {
            "lookup": {
                "contact_ip_ver": "v6",
                "lookup": "https://whatismyip.example.org"
            }
        }
    ],
    "identity": {
        "identity": {
            "local": "/var/spagh/host.ident"
        },
        "self_publish": true,
        "self_tls": true
    },
    "node": {
        "bind_addr": "0:43890",
        "bootstrap": []
    },
    "persistent_dir": "/var/spagh/persistent",
    "publisher": {
        "advertise_port": null,
        "bind_addr": "0:43891"
    },
    "resolver": {
        "dns_bridge": {
            "tcp_bind_addrs": [
                "0:8853",
                "[::]:8853"
            ],
            "udp_bind_addrs": [
                "0:53",
                "[::]:53"
            ]
        },
        "max_cache": null
    }
}